<?xml version="1.0" encoding="UTF-8"?>
<!--This document defines a mapping from any xml to CIDOC-CRM v5.0.1. Based on Mapping Language defined in "Mapping Language for Information Integration" Technical Report 385, ICS-FORTH, December 2006-->
<!--Institute of Computer Science, FORTH-ICS, Heraklio, Crete, Greece: Evangelia Daskalaki(eva@ics.forth.gr) , Martin Doerr(martin@ics.forth.gr)-->
<mapping xsi:noNamespaceSchemaLocation="MappingLanguage_v1.0.xsd" xmlns:xsi="http://www.w3.org/2001/XMLSchema-instance">
	<map>
		<!-- RecID -->
		<domain_map>
			<src_domain>/rmxml/mus_catalogue</src_domain>
			<target_domain>E22_Man_Made_Object</target_domain>
			<uri_rules> 
				<uri_function>
					<!--<name>uuid</name>-->
					<name>uriPhysThing</name>
					<arguments>//variant_key/_/text()</arguments>
				</uri_function>
			</uri_rules>
		</domain_map>
		
		<link_map>
			<range_map>
			
				<src_range>//variant_key/_</src_range>
				<target_range>E22_Man_Made_Object</target_range>
				<uri_rules>
					<uri_function>
						<name>uriPhysThing</name>
						<arguments>text()</arguments>
					</uri_function>
				</uri_rules>
			</range_map> 		
			<path_map>
				<src_path>//variant_key/_</src_path>
				<target_path>
					<int_link>is composed of</int_link>
				</target_path>
			</path_map> 
			
		</link_map>
		<link_map>
			<range_map>
				<src_range>//mus_object_name/_</src_range>
				<target_range>Literal</target_range>
				<uri_rules>
					<uri_function>
						<name>uriPhysThing</name>
						<arguments>text()</arguments>
					</uri_function>
				</uri_rules>
			</range_map> 		
			<path_map>
				<src_path>//mus_object_name/_</src_path>
				<target_path>
					<int_link>crmdig:L4F.has_preferred_label</int_link>
				</target_path>
			</path_map> 	
		</link_map>
		<link_map>
			<range_map>
				<src_range>//vanda_museum_number</src_range>
				<target_range>Literal</target_range>
				<uri_rules>
					<uri_function>
						<name>createLiteral</name>
						<arguments>text()</arguments>
					</uri_function>
				</uri_rules>
			</range_map> 		
			<path_map>
				<src_path>//vanda_museum_number</src_path>
				<target_path>
					<int_link>crmdig:L4F.has_inventory_no</int_link>
				</target_path>
			</path_map> 	
		</link_map>	
		
	</map>
	
	
	
	
	
	<map>
		<!-- RecID -->
		<domain_map>
			<src_domain>/rmxml/mus_catalogue/mus_part</src_domain>
			<target_domain>E22_Man_Made_Object</target_domain>
			<uri_rules> 
				<uri_function>
					<!--<name>uuid</name>-->
					<name>uriPhysThing</name>
					<arguments>//_/mus_part_obj_num/mus_part_obj_num_display/text()</arguments>
				</uri_function>
			</uri_rules>
		</domain_map>
		
		<link_map>
			<range_map>
			
				<src_range>//_/mus_part_name/_/mus_part_name_field/mus_part_name_field_val</src_range>
				<target_range>E55.Type</target_range>
				<uri_rules>
					<uri_function>
						<name>uriPhysThing</name>
						<arguments>text()</arguments>
					</uri_function>
				</uri_rules>
			</range_map> 		
			<path_map>
				<src_path>//_/mus_part_name/_/mus_part_name_field/mus_part_name_field_val</src_path>
				<target_path>
					<int_link>P3.has_type</int_link>
				</target_path>
			</path_map> 
			
		</link_map>
	</map>
</mapping>

		